{
  "$schema": "http://json-schema.org/draft-07/schema#",
  "title": "MCQ Maker question set",
  "description": "Canonical question set produced by the mcq-maker skill. Options are stored in any order with an explicit answer index; the build step / quiz JS performs the balanced position shuffle, so authored order does NOT need to be randomized here.",
  "type": "object",
  "required": ["title", "topics"],
  "properties": {
    "title": { "type": "string", "description": "Quiz title (usually derived from the source document)." },
    "source": { "type": "string", "description": "Name/path of the source document." },
    "config": {
      "type": "object",
      "properties": {
        "levelPoints": {
          "type": "object",
          "description": "Points per conceptual level. Defaults to {\"1\":1,\"2\":2,\"3\":3}.",
          "properties": {
            "1": { "type": "number" },
            "2": { "type": "number" },
            "3": { "type": "number" }
          }
        }
      }
    },
    "topics": {
      "type": "array",
      "minItems": 1,
      "description": "Topics from the source. Questions are kept grouped by topic; topics are never interleaved.",
      "items": {
        "type": "object",
        "required": ["name", "questions"],
        "properties": {
          "name": { "type": "string" },
          "questions": {
            "type": "array",
            "minItems": 1,
            "items": {
              "type": "object",
              "required": ["id", "category", "question", "options", "answer"],
              "properties": {
                "id": { "type": "string", "description": "Unique id across the whole set, e.g. t1-q3." },
                "category": {
                  "type": "string",
                  "enum": ["theory", "problem_solving", "conceptual"]
                },
                "level": {
                  "type": ["integer", "null"],
                  "enum": [1, 2, 3, null],
                  "description": "REQUIRED when category is conceptual (1=Understand/Apply, 2=Analyze, 3=Evaluate/Create). Must be null/absent otherwise."
                },
                "question": { "type": "string", "description": "The stem. Must not hint at the correct option." },
                "options": {
                  "type": "array",
                  "minItems": 4,
                  "maxItems": 4,
                  "items": { "type": "string" },
                  "description": "Exactly four options. Similar in length/format; distractors plausible."
                },
                "answer": {
                  "type": "integer",
                  "minimum": 0,
                  "maximum": 3,
                  "description": "Index (0-3) of the correct option within `options` as authored. Position is re-randomized at build/quiz time."
                },
                "explanation": {
                  "type": "string",
                  "description": "Why the answer is correct and the distractors are wrong. Recommended, especially for conceptual."
                }
              }
            }
          }
        }
      }
    }
  }
}
